player,era,date,outlet,headline,body,url
Stephen Curry,post_2009,2026-03-22,Yahoo Entertainment,Kevin Durant Admits He is Creeping Closer to Retirement,"If you click 'Accept all', we and our partners, including 247 who are part of the IAB Transparency &amp; Consent Framework, will also store and / or access information on a device (in other words, us…",https://consent.yahoo.com/v2/collectConsent?sessionId=1_cc-session_461b5ef6-cca6-455d-9f7e-80db5033ac55
Stephen Curry,post_2009,2026-03-23,Deadline,Kenya Barris To Make Documentary Directing Debut With Jerry West Doc For Amazon,"EXCLUSIVE: Jerry West, the former LA Laker who is widely considered one of the NBA greats, is getting the documentary treatment. Amazon has ordered Jerry West: The Logo, a feature-length doc about M…",http://deadline.com/2026/03/kenya-barris-documentary-directing-debut-jerry-west-amazon-1236761880/
Stephen Curry,post_2009,2026-03-23,"HITC - Football, Gaming, Movies, TV, Music","Lakers legend has ‘no way’ reaction to Steph Curry, Kevin Durant topping Michael Jordan on a list",Metta World Peace has strongly disagreed with a recent ranking that placed Stephen Curry and Kevin Durant above Michael Jordan as pure scorers. The former Los Angeles Lakers star reacted after a lis…,https://www.hitc.com/lakers-legend-has-no-way-reaction-to-steph-curry-kevin-durant-topping-michael-jordan-on-a-list/
Stephen Curry,post_2009,2026-03-24,Yahoo Entertainment,"Stephen Curry will participate in play-in tourney for Warriors if he's able, Steve Kerr says","If you click 'Accept all', we and our partners, including 247 who are part of the IAB Transparency &amp; Consent Framework, will also store and / or access information on a device (in other words, us…",https://consent.yahoo.com/v2/collectConsent?sessionId=1_cc-session_374140a9-e73f-4795-ae83-861a56d179de
Stephen Curry,post_2009,2026-03-24,Sportsnaut,Stephen Curry Injury Update: Golden State Warriors Reveal Return Timeline,"The Golden State Warriors have been without star point guard Stephen Curry for almost two months. Curry, who has been out with patella-femoral pain syndrome and bone bruising in his right knee, hasnt…",https://sportsnaut.com/nba/stephen-curry-injury-update-return-timeline
Stephen Curry,post_2009,2026-03-24,USA Today,Warriors guard Moses Moody suffers gruesome non-contact injury,"The Golden State Warriors can't catch a break this season when it comes to the injury bug. After receiving news that Stephen Curry has made ""good progress,"" the Warriors seemingly lose another playe…",https://www.usatoday.com/story/sports/nba/2026/03/24/golden-state-warriors-guard-moses-moody-has-non-contact-knee-injury/89296242007/
Stephen Curry,post_2009,2026-03-24,New York Post,Moses Moody carted off after suffering gruesome injury in Warriors win,Warriors guard Moses Moody thought he had just made the dagger defensive play to put an exclamation point on a big victory against the Mavericks before his knee gave way Monday night. Moody stole th…,https://nypost.com/2026/03/24/sports/warriors-moses-moody-carted-off-after-gruesome-overtime-injury/?utm_source=yahoo&amp;utm_campaign=nypost&amp;utm_medium=referral
Stephen Curry,post_2009,2026-03-24,Yahoo Entertainment,NBPA calls for 65-game rule to be 'abolished or reformed' after Cade Cunningham's injury,The National Basketball Players Association (NBPA) is calling for the abolishment of the leagues 65-game rule following a likely season-ending injury to Detroit Pistons star Cade Cunningham. The NBP…,https://sports.yahoo.com/nba/breaking-news/article/nbpa-calls-for-65-game-rule-to-be-abolished-or-reformed-after-cade-cunninghams-injury-183921252.html
Stephen Curry,post_2009,2026-03-25,Yahoo Entertainment,What Stephen Curry reminded Tiger Woods of before TGL’s SoFi Cup,"If you click 'Accept all', we and our partners, including 251 who are part of the IAB Transparency &amp; Consent Framework, will also store and / or access information on a device (in other words, us…",https://consent.yahoo.com/v2/collectConsent?sessionId=1_cc-session_592ebb76-76a9-403f-9b83-cf09fe84c88f
Stephen Curry,post_2009,2026-03-25,New York Post,Knicks are rolling — but now come real tests,The Knicks are about to return to reality. They carry a seven-game winning streak to their four-game road trip. All seven of those wins came against teams under. 500. All but one came against teams …,https://nypost.com/2026/03/25/sports/knicks-rolling-with-7-game-win-streak-but-now-come-real-tests/?utm_source=yahoo&amp;utm_campaign=nypost&amp;utm_medium=referral
Stephen Curry,post_2009,2026-03-25,The Sportsrush,"Steve Kerr Says Warriors Won’t Push Steph Curry’s Return, Unwilling to Risk Further Injury","Theres just a few weeks of regular season basketball left and the Golden State Warriors are still missing Stephen Curry, who continues to recover from knee injury. Their playoff hopes are already dwi…",https://thesportsrush.com/nba-news-steve-kerr-says-warriors-wont-push-steph-currys-return-unwilling-to-risk-further-injury/
Stephen Curry,post_2009,2026-03-26,Business Insider,Stephen Curry says one rule about when to 'quit' keeps his marriage strong,Stephen Curry.Michael Tran / AFP Stephen Curry says a simple rule has helped shape the way he approaches his marriage.The NBA player says he believes that neither partner can check …,https://www.businessinsider.com/stephen-curry-rule-quit-keeps-marriage-strong-ayesha-nba-2026-3
Stephen Curry,post_2009,2026-03-26,New York Post,Tanking Nets battle but fall to Warriors for ninth straight loss,"SAN FRANCISCO Gui Santos scored a career-high 31 points, Draymond Green made two clutch free throws with 6.9 seconds remaining and the Golden State Warriors beat the Nets 109-106 on Wednesday to clin…",https://nypost.com/2026/03/26/sports/tanking-nets-battle-but-fall-to-warriors-for-ninth-straight-loss/?utm_source=yahoo&amp;utm_campaign=nypost&amp;utm_medium=referral
Stephen Curry,post_2009,2026-03-26,Sporting News,Kon Knueppel eyes records set by splash brothers Stephen Curry and Klay Thompson,Kon Knueppel eyes records set by splash brothers Stephen Curry and Klay Thompson originally appeared on The Sporting News. Add The Sporting News as a Preferred Source by clicking here. The Charlotte…,https://www.sportingnews.com/us/nba/charlotte-hornets/news/kon-knueppel-eyes-splash-brother-stephen-curry-klay-thompson/d5bd82b61b294175073da009
Stephen Curry,post_2009,2026-03-26,Yahoo Entertainment,Warriors hand the Nets their ninth straight loss with a 109-106 victory,"SAN FRANCISCO (AP) Gui Santos scored a career-high 31 points, Draymond Green made two clutch free throws with 6.9 seconds remaining and the Golden State Warriors beat the Brooklyn Nets 109-106 on Wed…",https://sports.yahoo.com/articles/warriors-hand-nets-ninth-straight-050620753.html
Stephen Curry,post_2009,2026-03-26,Variety,‘The Reunion: Laguna Beach’ Trailer: Original Cast Reunites 20 Years Later (TV News Roundup),"“The Reunion: Laguna Beach” has a new trailer, released by Roku. The highly anticipated reunion special will be available on the streaming service on April 10. 20 years since the MTV reality series…",https://variety.com/2026/tv/news/tv-news-roundup-week-of-march-23-1236696947/
