player,era,date,outlet,headline,body,url
Stephen Curry,post_2009,2026-03-06,Yahoo Entertainment,Brandin Podziemski's OT spree helps undermanned Warriors top Rockets,"If you click 'Accept all', we and our partners, including 246 who are part of the IAB Transparency &amp; Consent Framework, will also store and / or access information on a device (in other words, us…",https://consent.yahoo.com/v2/collectConsent?sessionId=1_cc-session_713cebf7-0d9c-4abb-8edd-2e2686945385
Stephen Curry,post_2009,2026-03-07,Golden State of Mind,How to watch Warriors vs. Thunder,The Golden State Warriors face another tough road test with Saturday nights primetime matchup against the Oklahoma City Thunder. Tip-off is scheduled for 5:30 PM PT in Oklahoma City and will be broad…,https://www.goldenstateofmind.com/warriors-game-previews/109023/how-to-watch-warriors-vs-thunder
Stephen Curry,post_2009,2026-03-08,BBC,Gilgeous-Alexander closes in on Chamberlain record,"Victory at Paycom Center was the Thunder's fifth in a row. They became the first side to 50 wins this season and sit top of the Western Conference. Gilgeous-Alexander said: ""If we were the best team…",https://www.bbc.com/sport/basketball/articles/c24d2l075epo
Stephen Curry,post_2009,2026-03-08,Golden State of Mind,Final Score: Warriors lose to Thunder 104-97 in Oklahoma City,"The Golden State Warriors lost to the reigning defending champion Oklahoma City Thunder tonight on the road, 104-97. They also missed seven free throws, egads! You can sit with that math however you…",https://www.goldenstateofmind.com/warriors-game-previews/109046/final-score-warriors-lose-to-thunder-104-97-in-oklahoma-city
Stephen Curry,post_2009,2026-03-08,Yahoo Entertainment,Utah plays Golden State on 4-game home slide,"Golden State Warriors (32-31, eighth in the Western Conference) vs. Utah Jazz (19-45, 14th in the Western Conference) Salt Lake City; Monday, 9 p.m. EDT BOTTOM LINE: Utah is looking to break its fo…",https://sports.yahoo.com/articles/utah-plays-golden-state-4-072320510.html
Stephen Curry,post_2009,2026-03-09,CBS Sports,Could LeBron James finish his career alongside Stephen Curry? Why a pairing feels more possible than ever,"Very few legends go out on top. John Elway and Peyton Manning did it, each winning a championship with the Broncos in their final season. Michael Jordan tried to do it, hitting the game-winning jumpe…",https://www.cbssports.com/nba/news/lebron-james-stephen-curry-rumors-pairing/
Stephen Curry,post_2009,2026-03-10,Yahoo Entertainment,"Sensabaugh scores 21, Hinson makes go-ahead 3 as depleted Jazz stun Warriors, 119-116","SALT LAKE CITY (AP) Brice Sensabaugh scored 21 points, two-way player Blake Hinson made the go-ahead 3-pointer in the final minute, and the depleted Utah Jazz outlasted the ailing Golden State Warrio…",https://sports.yahoo.com/articles/sensabaugh-scores-21-hinson-makes-040151769.html
Stephen Curry,post_2009,2026-03-11,Yahoo Entertainment,"Stephen Curry begins on-court work, but will miss another 5 games for Warriors","Stephen Curry still isnt coming through that door for the Golden State Warriors. The former MVP will miss at least another 10 days due to a persistent knee issue, according to ESPN. That guarantees …",https://sports.yahoo.com/mlb/article/stephen-curry-begins-on-court-work-but-will-miss-another-5-games-for-warriors-193052361.html
Stephen Curry,post_2009,2026-03-11,Yahoo Entertainment,"Stephen Curry begins on-court work, but will miss another 5 games for Warriors","Stephen Curry still isnt coming through that door for the Golden State Warriors. The former MVP will miss at least another 10 days due to a persistent knee issue, the team announced Wednesday, descr…",https://sports.yahoo.com/nba/article/stephen-curry-begins-on-court-work-but-will-miss-another-5-games-for-warriors-193052361.html
Stephen Curry,post_2009,2026-03-11,Yahoo Entertainment,Stephen Curry to miss at least another 10 days for Warriors because of right knee injury,"If you click 'Accept all', we and our partners, including 245 who are part of the IAB Transparency &amp; Consent Framework, will also store and / or access information on a device (in other words, us…",https://consent.yahoo.com/v2/collectConsent?sessionId=1_cc-session_94d4f11a-0d20-40c5-8e3a-717cceca79d4
Stephen Curry,post_2009,2026-03-11,NBCSports.com,Stephen Curry reportedly out another 10 days with lingering knee issue,Stephen Curry has missed 15 games due to patella-femoral pain syndrome/bone bruising commonly called runner's knee and in that stretch the Warriors have gone 5-10 and slid to ninth in the Western Con…,https://www.nbcsports.com/nba/news/stephen-curry-reportedly-out-another-10-days-with-lingering-knee-issue
Stephen Curry,post_2009,2026-03-11,Yahoo Entertainment,Stephen Curry knee issue described as 'unpredictable',"If you click 'Accept all', we and our partners, including 245 who are part of the IAB Transparency &amp; Consent Framework, will also store and / or access information on a device (in other words, us…",https://consent.yahoo.com/v2/collectConsent?sessionId=1_cc-session_49d2f3a0-76df-4cd7-a0f1-eb74af8c8c26
Stephen Curry,post_2009,2026-03-11,USA Today,Warriors issue Stephen Curry injury update: What does it mean?,"The Golden State Warriors have lost three consecutive games and 10 of 15 since All-Star guard Stephen Curry went down with a right knee injury. The team, for at least the short term, will continue t…",https://www.usatoday.com/story/sports/nba/warriors/2026/03/11/stephen-curry-injury-update-warriors-knee-status/89106104007/
Stephen Curry,post_2009,2026-03-11,New York Post,Warriors rule out Curry for at least five more games with knee issue,"The Warriors will be without Steph Curry for at least five more games. Curry is making good progress in his recovery from patella-femoral pain syndrome, commonly known as runners knee, according to …",https://nypost.com/2026/03/11/sports/warriors-curry-knee-ruled-out-for-at-least-5-more-games/?utm_source=yahoo&amp;utm_campaign=nypost&amp;utm_medium=referral
Stephen Curry,post_2009,2026-03-11,Yahoo Entertainment,"Buzelis scores career-high 41 points and hits key 3-pointer in overtime, Bulls beat Warriors 130-124","SAN FRANCISCO (AP) Matas Buzelis scored a career-high 41 points and hit a key 3-pointer with 2:20 left in overtime, Josh Giddey had a triple-double of 21 points, 17 assists and 13 rebounds, and the C…",https://sports.yahoo.com/articles/buzelis-scores-career-high-41-045421203.html
Stephen Curry,post_2009,2026-03-12,Harvard Business Review,How to Turn Individual Talent into Organizational Excellence,"At the start of 2026, the CEO of a financial services firm sent a firmwide email that included a clip of NBA star Stephen Curry taking an almost full-court shot. The ball drops cleanly through the ne…",https://hbr.org/2026/03/how-to-turn-individual-talent-into-organizational-excellence
Stephen Curry,post_2009,2026-03-12,USA Today,Warriors' Steve Kerr Reveals Stephen Curry's Frustration Over Injury,We haven't seen Stephen Curry in the Golden State Warriors' rotation since the team's Jan. 30 loss to the Detroit Pistons. The veteran sharpshooter is dealing with a persistent knee issue. He has mis…,https://warriorswire.usatoday.com/story/sports/nba/warriors/2026/03/12/steve-kerr-reveals-stephen-currys-frustration-over-injury/89125663007/
Stephen Curry,post_2009,2026-03-12,USA Today,"Warriors' Stephen Curry ""Extremely Motivated"" For Return From Injury","On Wednesday, March 11, the Golden State Warriors announced that Stephen Curry would miss a further 10 days due to a persistent knee issue. The veteran guard has already been sidelined for the Warrio…",https://warriorswire.usatoday.com/story/sports/nba/warriors/2026/03/12/stephen-curry-extremely-motivated-for-return-from-injury/89126301007/
Stephen Curry,post_2009,2026-03-12,Yahoo Entertainment,Steve Kerr Reveals Steph Curry’s Frustration at Prolonged Knee Recovery,"If you click 'Accept all', we and our partners, including 245 who are part of the IAB Transparency &amp; Consent Framework, will also store and / or access information on a device (in other words, us…",https://consent.yahoo.com/v2/collectConsent?sessionId=1_cc-session_3ab392f1-ec3b-4e6d-8db8-ecbd8ebf2e25
Stephen Curry,post_2009,2026-03-12,New York Post,Knicks come up big after ‘get our s–t together’ halftime challenge,"SALT LAKE CITY There was no sugarcoating an ugly first-half performance from the Knicks in the locker room, and the harsh words during the break helped spur a comeback in Wednesdays 134-117 victory o…",https://nypost.com/2026/03/12/sports/knicks-come-up-big-after-get-our-s-t-together-halftime-challenge/?utm_source=yahoo&amp;utm_campaign=nypost&amp;utm_medium=referral
Stephen Curry,post_2009,2026-03-13,Golden State of Mind,Kristaps Porziņģis eager to play with a healthy Stephen Curry,"The Golden State Warriors are still waiting to see what they look like at full strength, but Kristaps Porziis already knows that one pairing in particular could change the team completely: sharing th…",https://www.goldenstateofmind.com/warriors-news/109141/dub-hub-kristaps-porzingis-eager-to-play-with-stephen-curry-as-warriors-await-his-return-from-knee-injury
Stephen Curry,post_2009,2026-03-13,Nbcsportsbayarea.com,"Injury-ravaged, free-falling Warriors take even more hits in loss to Timberwolves","Injury-ravaged, free-falling Warriors take even more hits in loss to Timberwolves originally appeared on NBC Sports Bay Area SAN FRANCISCO Like the Billboard R&amp;B Top 100 List, the hits keep com…",https://www.nbcsportsbayarea.com/nba/golden-state-warriors/al-horford-seth-curry-injuries/1923950/?partner=yahoo
Stephen Curry,post_2009,2026-03-14,USA Today,Warriors ‘fear’ Stephen Curry knee injury could worsen if he returns,"Stephen Curry's knee injury continues to linger. The Golden State Warriors' superstar has already missed 16 consecutive games, and won't be re-evaluated until after the team's East Coast road trip th…",https://warriorswire.usatoday.com/story/sports/nba/warriors/2026/03/14/warriors-fear-stephen-curry-knee-injury-could-worsen-if-he-returns/89151858007/
Stephen Curry,post_2009,2026-03-14,Yahoo Entertainment,"Warriors' tailspin continues as Al Horford, Seth Curry will be out vs. Knicks: 'We're going through it'",Injuries continue to ravage the Golden State Warriors after the team lost four more players Friday night during their 127-117 loss to the Minnesota Timberwolves. Lower back soreness knocked out Dray…,https://sports.yahoo.com/nba/article/warriors-tailspin-continues-as-al-horford-seth-curry-will-be-out-vs-knicks-were-going-through-it-140759643.html
Stephen Curry,post_2009,2026-03-14,Yahoo Entertainment,"Warriors sign 6-foot-11 former Thunder, Heat center to assist Stephen Curry","If you click 'Accept all', we and our partners, including 245 who are part of the IAB Transparency &amp; Consent Framework, will also store and / or access information on a device (in other words, us…",https://consent.yahoo.com/v2/collectConsent?sessionId=1_cc-session_8825bf62-b8d7-4c83-a0a8-b60af63312fa
Stephen Curry,post_2009,2026-03-14,Yahoo Entertainment,Anthony Edwards' 42 points lead Timberwolves to 127-117 win against undermanned Warriors,"SAN FRANCISCO (AP) Anthony Edwards scored 42 points and the Minnesota Timberwolves held off the injury-plagued Golden State Warriors 127-117 on Friday night. Edwards shot 13 for 22, made all 12 of h…",https://sports.yahoo.com/articles/anthony-edwards-42-points-lead-044147763.html
Stephen Curry,post_2009,2026-03-15,Golden State of Mind,How to watch Warriors vs. Knicks,The Golden State Warriors begin their six-game road trip with Sundays matchup against the New York Knicks. The game is scheduled to be played at 5:00 PM PT in New York City and can be watched on NBC …,https://www.goldenstateofmind.com/warriors-game-previews/109175/how-to-watch-warriors-vs-knicks
Stephen Curry,post_2009,2026-03-16,CBS Sports,"Warriors' Stephen Curry wants to return this season, reiterates he's 'working to get back'","Stephen Curry still wants to play this season. The Golden State Warriors superstar, who has been dealing with runner's knee and hasn't played since Jan. 30, reiterated after their 110-107 loss agains…",https://www.cbssports.com/nba/news/warriors-stephen-curry-injury-timeline-return/
Stephen Curry,post_2009,2026-03-16,Yahoo Entertainment,"Stephen Curry traveling on road trip with the Warriors, who lose 2 more players for at least a week","NEW YORK (AP) Stephen Curry is traveling with Golden State on its road trip, which is the closest the Warriors get to good injury news these days. Curry missed his 17th consecutive game Sunday night…",https://sports.yahoo.com/articles/stephen-curry-traveling-road-trip-002421273.html
Stephen Curry,post_2009,2026-03-16,Yahoo Entertainment,Warriors' Steve Kerr provides encouraging Stephen Curry update,"If you click 'Accept all', we and our partners, including 245 who are part of the IAB Transparency &amp; Consent Framework, will also store and / or access information on a device (in other words, us…",https://consent.yahoo.com/v2/collectConsent?sessionId=1_cc-session_753d0b96-f1e5-4e61-8be1-8b09f13f1054
Stephen Curry,post_2009,2026-03-16,Yahoo Entertainment,Knicks rally from a 21-point deficit and beat the short-handed Warriors 110-107,"NEW YORK (AP) Jalen Brunson had 30 points and nine assists, and the New York Knicks rallied from a 21-point deficit against a patchwork Golden State lineup to beat the Warriors 110-107 on Sunday nigh…",https://sports.yahoo.com/articles/knicks-rally-21-point-deficit-030029112.html
Stephen Curry,post_2009,2026-03-16,New York Post,Steve Kerr says Steph Curry will ‘for sure’ be back this season,"Theres no doubt in Steve Kerrs mind that Steph Curry will return this season. We expect him back, the Warriors coach told NBCs Bob Costas in an on-court interview before their 110-107 loss to the Kn…",https://nypost.com/2026/03/16/sports/warriors-kerr-steph-curry-for-sure-returning-this-season/?utm_source=yahoo&amp;utm_campaign=nypost&amp;utm_medium=referral
Stephen Curry,post_2009,2026-03-16,Pounding The Rock,Open Thread: How the the rest of the NBA views Wemby,"Recently, Jaylen Brown referred to himself as the best two-way player in the game. But he added a caveat when considering Victor Wembanyama in the league. That boy Wemby is a problem, a big problem.…",https://www.poundingtherock.com/spurs-discussion-threads/97319/open-thread-how-the-the-rest-of-the-nba-views-wemby
Stephen Curry,post_2009,2026-03-17,Deadline,Sony Pictures & Macro Film Studios Ink Multiyear First-Look & Co-Financing Pact,"EXCLUSIVE: Sony Pictures and Macro Film Studios have closed a multiyear exclusive first-look, co-financing and distribution agreement. Under the deal, Sony Pictures will have an exclusive first look…",http://deadline.com/2026/03/sony-macro-1236757669/
Stephen Curry,post_2009,2026-03-17,Yahoo Entertainment,"Kerr earns 600th win, and Golden State hands Wizards their 12th straight loss","WASHINGTON (AP) Kristaps Porzingis scored 30 points, DeAnthony Melton added 27 and the Golden State Warriors snapped a five-game losing streak with a 125-117 victory over the Washington Wizards on Mo…",https://sports.yahoo.com/articles/kerr-earns-600th-win-golden-030848562.html
Stephen Curry,post_2009,2026-03-17,Yahoo Entertainment,Kristaps Porzingis calls new teammate Stephen Curry ‘the GOAT’,"If you click 'Accept all', we and our partners, including 247 who are part of the IAB Transparency &amp; Consent Framework, will also store and / or access information on a device (in other words, us…",https://consent.yahoo.com/v2/collectConsent?sessionId=1_cc-session_02131c16-e42d-4b54-b286-c418b53b8adf
Stephen Curry,post_2009,2026-03-17,Yahoo Entertainment,"Golden State snaps a 5-game skid and hands the Wizards their 12th loss in a row, 125-117","If you click 'Accept all', we and our partners, including 245 who are part of the IAB Transparency &amp; Consent Framework, will also store and / or access information on a device (in other words, us…",https://consent.yahoo.com/v2/collectConsent?sessionId=1_cc-session_12bc6bb8-7726-4ada-b70a-ab1042669a91
Stephen Curry,post_2009,2026-03-18,CBS Sports,Why the Warriors need to keep Stephen Curry on the shelf and officially embrace the tank,"The Golden State Warriors have been soft tanking for a while, but they won't tell you that. They definitely didn't start out doing it intentionally, and truth be told, they're probably still not. The…",https://www.cbssports.com/nba/news/stephen-curry-injury-warriors-tank-nba-draft-lottery/
Stephen Curry,post_2009,2026-03-18,Nbcsportsbayarea.com,Warriors reportedly optimistic Steph Curry will return before end of the month,"Warriors reportedly optimistic Steph Curry will return before end of the month originally appeared on NBC Sports Bay Area Steph Curry might be nearing a return to the court. The Warriors superstar,…",https://www.nbcsportsbayarea.com/nba/golden-state-warriors/steph-curry-return-knee-injury/1924823/?partner=yahoo
Stephen Curry,post_2009,2026-03-18,Yahoo Entertainment,Is Steph Curry playing today? How much longer will he be out?,"If you click 'Accept all', we and our partners, including 247 who are part of the IAB Transparency &amp; Consent Framework, will also store and / or access information on a device (in other words, us…",https://consent.yahoo.com/v2/collectConsent?sessionId=1_cc-session_69262fe5-3a20-4640-a867-0ef432cd7de2
Stephen Curry,post_2009,2026-03-18,Yahoo Entertainment,Coach Bob McKillop reveals the foundation of his relationship with Dell Curry,"Davidson Head Coach Bob McKillop first met Dell Curry on a youth baseball field years before recruiting his son, Stephen Curry, to play college basketball. The relationship began when their sons wer…",https://sports.yahoo.com/articles/coach-bob-mckillop-reveals-foundation-233224124.html
Stephen Curry,post_2009,2026-03-18,San Francisco Chronicle,Steph Curry works out pregame for Warriors with status update due Saturday,"BOSTON - Stephen Curry graced the parquet twice on Wednesday inside TD Garden: at morning shoot-around with the Golden State Warriors, then again hours before they played the Boston Celtics. ""Feels …",https://www.sfchronicle.com/sports/warriors/article/steph-curry-works-pregame-warriors-status-update-22084222.php
Stephen Curry,post_2009,2026-03-19,Hoops Hype,"Stephen Curry on father Dell Curry's jersey retirement: It means the world to us, I'm so excited","Beyond his accomplishments in Charlotte as a player, Dell Curry is a television analyst with the Hornets and Amazon Prime, and he has been an ambassador and special adviser for the franchise. It mean…",https://www.hoopshype.com/story/sports/nba/rumors/2026/03/19/stephen-curry-on-father-dell-currys-jersey-retirement-it-means-the-world-to-us-im-so-excited/89232361007/
Stephen Curry,post_2009,2026-03-19,New York Post,Celtics fan ejected after pulling on Steph Curry’s arm,Thats an easy way to get thrown out of the arena. A fan attending the Celtics dominant 120-99 win over the Warriors at TD Garden Arena in Boston was ejected on Wednesday after an incident in which t…,https://nypost.com/2026/03/19/sports/celtics-fan-ejected-after-pulling-on-steph-currys-arm/?utm_source=yahoo&amp;utm_campaign=nypost&amp;utm_medium=referral
Stephen Curry,post_2009,2026-03-19,Sporting News,Stephen Curry reveals what Dell Curry's jersey retirement means to him,Stephen Curry reveals what Dell Curry's jersey retirement means to him originally appeared on The Sporting News. Add The Sporting News as a Preferred Source by clicking here. The Charlotte Hornets e…,https://www.sportingnews.com/us/nba/charlotte-hornets/news/stephen-curry-reveals-dell-curry-jersey-retirement-means-him/3c427d9ece78d8923ec5286c
Stephen Curry,post_2009,2026-03-19,Sporting News,"Warriors officially sign 6-foot-11 former Heat, Thunder center to assist Stephen Curry","Stephen Curry IMAGN 02192026 Warriors officially sign 6-foot-11 former Heat, Thunder center to assist Stephen Curry originally appeared on The Sporting News. Add The Sporting News as a Preferred Sou…",https://www.sportingnews.com/us/nba/golden-state-warriors/news/warriors-officially-sign-6-foot-11-former-heat-thunder-center-assist-stephen-curry/cf535a1ca043b6ea5014adce
Stephen Curry,post_2009,2026-03-20,USA Today,Warriors' Kristaps Porzingis shares excitment over playing with Curry,Stephen Curry has missed the Golden State Warriors' last 18 games. He will remain on the shelf for at least two more weeks before being re-evaluated by the team's medical staff. Due to Curry's injury…,https://warriorswire.usatoday.com/story/sports/nba/warriors/2026/03/20/warriors-kristaps-porzingis-shares-excitment-over-playing-with-curry/89253731007/
Stephen Curry,post_2009,2026-03-20,The Sportsrush,NBA Analyst Believes Tanking Could Benefit Warriors More Than Stephen Curry Dominating the Play-In,"The Golden State Warriors are in the limbo portion of their post-dynasty run. On any given night, they are still fun to watch, mainly because of Steph Curry and Draymond Green. But the Dubs do have a…",https://thesportsrush.com/nba-news-nba-analyst-believes-tanking-could-benefit-warriors-more-than-stephen-curry-dominating-the-play-in/
Stephen Curry,post_2009,2026-03-21,Yahoo Entertainment,Warriors provide injury update on Steph Curry: 'good progress',"If you click 'Accept all', we and our partners, including 247 who are part of the IAB Transparency &amp; Consent Framework, will also store and / or access information on a device (in other words, us…",https://consent.yahoo.com/v2/collectConsent?sessionId=1_cc-session_865049ca-64fa-4ffd-8975-7f2e66e486e1
Stephen Curry,post_2009,2026-03-21,NBCSports.com,"Stephen Curry being 'incorporated into live action and team practices,' could return next week","In some much-needed good news for the Warriors, Stephen Curry is close to returning. Curry will be out for the Warriors' next two games as he continues to recover from patella-femoral pain syndrome …",https://www.nbcsports.com/nba/news/stephen-curry-being-incorporated-into-live-action-and-team-practices-could-return-next-week
Stephen Curry,post_2009,2026-03-21,Yahoo Entertainment,Stephen Curry to resume full team practices in the coming days as he recovers from knee injury,"If you click 'Accept all', we and our partners, including 247 who are part of the IAB Transparency &amp; Consent Framework, will also store and / or access information on a device (in other words, us…",https://consent.yahoo.com/v2/collectConsent?sessionId=1_cc-session_13069d7b-aabf-468c-a902-ec5180245d28
Stephen Curry,post_2009,2026-03-21,Yahoo Entertainment,Warriors provide encouraging Stephen Curry injury update,"If you click 'Accept all', we and our partners, including 247 who are part of the IAB Transparency &amp; Consent Framework, will also store and / or access information on a device (in other words, us…",https://consent.yahoo.com/v2/collectConsent?sessionId=1_cc-session_0766abf2-a4cd-4274-a6ae-e118256968c4
Stephen Curry,post_2009,2026-03-21,Yahoo Entertainment,"Stephen Curry progressing in recovery, set to miss at least two more games","If you click 'Accept all', we and our partners, including 247 who are part of the IAB Transparency &amp; Consent Framework, will also store and / or access information on a device (in other words, us…",https://consent.yahoo.com/v2/collectConsent?sessionId=1_cc-session_f82569cc-f8a5-46ed-aa26-61b6baf80d51
Stephen Curry,post_2009,2026-03-21,Yahoo Entertainment,"Stephen Curry nears return for Warriors, but will miss at least 2 more games as regular season winds down","Stephen Curry is nearing a return for the Golden State Warriors, but wont have much time to get right in even a best-case scenario. The Warriors announced Saturday that Curry, who has missed nearly …",https://sports.yahoo.com/nba/article/stephen-curry-nears-return-for-warriors-but-will-miss-at-least-2-more-games-as-regular-season-winds-down-214522104.html
Stephen Curry,post_2009,2026-03-22,USA Today,Warriors' Stephen Curry set for major checkpoint in injury recovery,"Stephen Curry has missed the Golden State Warriors' last 20 games due to injury. However, after recently being re-evaluated by the team's medical staff, the veteran guard is expected to ramp up his o…",https://warriorswire.usatoday.com/story/sports/nba/warriors/2026/03/21/warriors-stephen-curry-set-for-major-checkpoint-in-injury-recovery/89269226007/
Stephen Curry,post_2009,2026-03-22,USA Today,Warriors' Steve Kerr makes honest admission after losing to Hawks,"The Golden State Warriors dropped their third consecutive game on Saturday, March 21, losing to the Atlanta Hawks 126-110. Stephen Curry, Al Horford, Seth Curry and Jimmy Butler were all on the injur…",https://warriorswire.usatoday.com/story/sports/nba/warriors/2026/03/22/warriors-steve-kerr-makes-honest-admission-after-losing-to-hawks/89273756007/
Stephen Curry,post_2009,2026-03-22,San Francisco Chronicle,"Warriors' De'Anthony Melton clears back-to-back hurdle, eyes Steph Curry's return",DALLAS De'Anthony Melton quietly found satisfaction in playing games on consecutive nights for the first time this season Friday and Saturday. That's no idle achievement for a player fewer than 16 mo…,https://www.sfchronicle.com/sports/warriors/article/warriors-de-anthony-melton-clears-hurdle-22090118.php
Stephen Curry,post_2009,2026-03-22,Yahoo Entertainment,"Fantasy Basketball Week 22 Schedule Primer: Will Anthony Edwards, Stephen Curry be available?","In Yahoo! default leagues, Week 22 is the semifinal round of the fantasy playoffs. While most NBA teams play four games, a few have bad schedules, either because of the games they play or where those…",https://sports.yahoo.com/articles/fantasy-basketball-week-22-schedule-100000654.html
