player,era,date,outlet,headline,body,url
LeBron James,post_2009,2026-03-19,Yanko Design,"Nike x Powerbeats Pro 2 earbuds promise great design, super secure fit, and impressive audio",Earbuds are a holy grail accessory for fitness freaks who want to get in the groove to focus on their goals without outside distractions or losing out on ambient awareness when needed. Shokz OpenFit …,https://www.yankodesign.com/2026/03/19/nike-x-powerbeats-pro-2-earbuds-promise-great-design-super-secure-fit-and-impressive-audio/
LeBron James,post_2009,2026-03-19,Al Jazeera,Luka Doncic scores 40 points as Lakers defeat Rockets in NBA,Luka Doncic had 40 points and LeBron James added 30 as the Los Angeles Lakers extended their winning streak to seven games with a 124-116 away win over the Houston Rockets on Wednesday night. Its th…,https://www.aljazeera.com/sports/2026/3/19/luka-doncic-scores-40-points-as-lakers-defeat-rockets-in-nba
LeBron James,post_2009,2026-03-19,Yahoo Entertainment,Lakers win second straight over Rockets behind Luka Dončić,"If you click 'Accept all', we and our partners, including 247 who are part of the IAB Transparency &amp; Consent Framework, will also store and / or access information on a device (in other words, us…",https://consent.yahoo.com/v2/collectConsent?sessionId=1_cc-session_530fcf5c-ce54-47e8-a56d-20e91c17f8a9
LeBron James,post_2009,2026-03-19,Yahoo Entertainment,LeBron James says he has no interest in owning an NBA team in Las Vegas,"If you click 'Accept all', we and our partners, including 247 who are part of the IAB Transparency &amp; Consent Framework, will also store and / or access information on a device (in other words, us…",https://consent.yahoo.com/v2/collectConsent?sessionId=1_cc-session_2c0ceb75-e6cb-47dc-9044-1737e04da297
LeBron James,post_2009,2026-03-19,Silver Screen and Roll,"Luka Dončić, LeBron James, Austin Reaves questionable vs. Heat","While the Lakers are currently on a roll, having won seven straight games after downing the Rockets on Wednesday, earning that eighth victory might be their toughest challenge yet. The team is set t…",https://www.silverscreenandroll.com/lakers-injury-report/111355/lakers-injury-report-luka-doncic-lebron-james-austin-reaves-status-update-heat
LeBron James,post_2009,2026-03-19,Yahoo Entertainment,Luka Doncic (40 points) and LeBron James (30) lead Lakers to win over Rockets,The combination of Luka Doncic and LeBron James was overpowering and enthralling for all to see during the Lakers dynamic 124-116 win over the Houston Rockets at Toyota Center on Wednesday. Doncic w…,https://sports.yahoo.com/articles/luka-doncic-40-points-lebron-042335534.html
LeBron James,post_2009,2026-03-19,USA Today,"LeBron James, Fenway Sports Group unlikely to pursue expansion team, per report","The Fenway Sports Group, which is a business partner of LeBron James, is not expected to pursue the potential NBA Las Vegas expansion team, according to a report by The Athletic. Las Vegas and Seatt…",https://www.usatoday.com/story/sports/nba/lakers/2026/03/18/lebron-james-nba-expansion-team-las-vegas-fenway-sports-group/89221739007/
LeBron James,post_2009,2026-03-19,Yahoo Entertainment,This opponent is the ideal matchup for the Lakers in the first round of the NBA Playoffs,"If you click 'Accept all', we and our partners, including 247 who are part of the IAB Transparency &amp; Consent Framework, will also store and / or access information on a device (in other words, us…",https://consent.yahoo.com/v2/collectConsent?sessionId=1_cc-session_265582d9-1e11-4de8-bd82-a4469412a30b
LeBron James,post_2009,2026-03-19,Yahoo Entertainment,Lakers’ LeBron James gives definitive answer on NBA ownership after Las Vegas tease,"If you click 'Accept all', we and our partners, including 247 who are part of the IAB Transparency &amp; Consent Framework, will also store and / or access information on a device (in other words, us…",https://consent.yahoo.com/v2/collectConsent?sessionId=1_cc-session_c961fa90-8bb7-4dd3-927f-c5cc792b96cb
LeBron James,post_2009,2026-03-20,BBC,Doncic matches Bryant as Lakers beat Heat,Luka Doncic became the first player since Kobe Bryant to score 60 points in a game for the LA Lakers as they overcame the Miami Heat 134-126. Doncic the NBA's leading scorer this season has reached…,https://www.bbc.com/sport/basketball/articles/czex56k6p09o
LeBron James,post_2009,2026-03-20,Alltoc.com,How did Luka Doncic top 60 points vs Heat? #sports,"Doncics 60 and Lakers eighth straight win Luka Doni delivered a standout scoring performance of 60 points as the Los Angeles Lakers defeated the Miami Heat 134-126. The game was played in Miami, and…",https://alltoc.com/sports/how-did-luka-doncic-top-60-points-vs-heat
LeBron James,post_2009,2026-03-20,Yahoo Entertainment,Is LeBron James likely to play for Cavs next season?,"If you click 'Accept all', we and our partners, including 247 who are part of the IAB Transparency &amp; Consent Framework, will also store and / or access information on a device (in other words, us…",https://consent.yahoo.com/v2/collectConsent?sessionId=1_cc-session_c3727cda-dd39-49fd-837e-2a568ddfb947
LeBron James,post_2009,2026-03-20,Yahoo Entertainment,Watch Luka Doncic drop 60 on Miami Heat as Lakers win eighth in a row,"If you click 'Accept all', we and our partners, including 247 who are part of the IAB Transparency &amp; Consent Framework, will also store and / or access information on a device (in other words, us…",https://consent.yahoo.com/v2/collectConsent?sessionId=1_cc-session_dbb55aaa-0904-4a6d-b5d8-123b47145548
LeBron James,post_2009,2026-03-20,Yahoo Entertainment,Luka Doncic scores 60 and LeBron ties NBA games record in Lakers' eighth straight win,"If you click 'Accept all', we and our partners, including 247 who are part of the IAB Transparency &amp; Consent Framework, will also store and / or access information on a device (in other words, us…",https://consent.yahoo.com/v2/collectConsent?sessionId=1_cc-session_9e1b480b-5b6e-4269-8507-80e9ee61fffb
LeBron James,post_2009,2026-03-20,Yahoo Entertainment,Doncic matches Bryant as Lakers beat Heat,"If you click 'Accept all', we and our partners, including 247 who are part of the IAB Transparency &amp; Consent Framework, will also store and / or access information on a device (in other words, us…",https://consent.yahoo.com/v2/collectConsent?sessionId=1_cc-session_ea5938ce-c5d8-48f7-9fdf-6693967be7a1
LeBron James,post_2009,2026-03-20,menshealth.com,"LeBron James Can't Golf, But the Nike x Beats Earbuds Keep His Head in the Game","Earlier this week, Nike and Beats announced a first-ever collaboration: the Nike x Powerbeats Pro 2 headphones.You can shop the limited-edition volt yellow headphones starting today.…",https://www.menshealth.com/technology-gear/a70782190/nike-beats-powerbeats-pro-2-collab-2026/
LeBron James,post_2009,2026-03-20,Yahoo Entertainment,LeBron James posts triple-double while tying Robert Parish's NBA games played record,Its official. No player in NBA history has played in more regular-season games than LeBron James. The Los Angeles Lakers star tied a three-decade-old record on Thursday with his appearance in a game…,https://sports.yahoo.com/nba/article/lebron-james-posts-triple-double-while-tying-robert-parishs-nba-games-played-record-001129342.html
LeBron James,post_2009,2026-03-20,New York Post,LeBron James on narrative that Lakers are better without him: ‘They’re absolutely wrong’,LeBron James brought up the narrative on his own. Clearly it had been bothering him. He has thick skin but this penetrated it. He ignores the white noise but this broke through. Are the Lakers bett…,https://nypost.com/2026/03/20/sports/lebron-james-shined-against-the-heat-in-back-to-back/?utm_source=yahoo&amp;utm_campaign=nypost&amp;utm_medium=referral
LeBron James,post_2009,2026-03-21,Silver Screen and Roll,LeBron James’ versatility is fueling his downsized role,"If the biggest talking point from the Lakers current 8-game winning streak is the unrelenting brilliance of Luka Doni as he scorches every defense in his path, the second most discussed topic is LeBr…",https://www.silverscreenandroll.com/lakers-analysis/111511/lebron-james-lakers-luka-doncic-jj-redick-role-offense-defense
LeBron James,post_2009,2026-03-21,Yahoo Entertainment,LeBron James is motivating his teammates just by continually being available,"If you click 'Accept all', we and our partners, including 247 who are part of the IAB Transparency &amp; Consent Framework, will also store and / or access information on a device (in other words, us…",https://consent.yahoo.com/v2/collectConsent?sessionId=1_cc-session_0bfbfa0d-9032-45ad-bfb0-811759715a5d
LeBron James,post_2009,2026-03-21,Yahoo Entertainment,LeBron James breaks record for most games ever played in NBA,"If you click 'Accept all', we and our partners, including 247 who are part of the IAB Transparency &amp; Consent Framework, will also store and / or access information on a device (in other words, us…",https://consent.yahoo.com/v2/collectConsent?sessionId=1_cc-session_532ae42d-28fb-4eac-8f31-3df01f9ea31d
LeBron James,post_2009,2026-03-21,Yahoo Entertainment,"LeBron James breaks Robert Parish's record, becomes NBA's all-time games played leader",No player in NBA history has played in more games than LeBron James. Or scored more points. Or made more All-Star teams. We could go on. The Los Angeles Lakers star broke his latest record on Saturd…,https://sports.yahoo.com/nba/article/lebron-james-breaks-robert-parishs-record-becomes-nbas-all-time-games-played-leader-231259435.html
LeBron James,post_2009,2026-03-22,BBC,James sets NBA appearance record in late Lakers win,"James - who is the first player to take part in 23 consecutive NBA seasons and is also the NBA's record points scorer - contributed 12 points, six rebounds, four assists and three steals as the Laker…",https://www.bbc.com/sport/basketball/articles/ckgwmwgg377o
LeBron James,post_2009,2026-03-22,CBS News,LeBron James breaks NBA mark for games played in Lakers' win over Magic,"LeBron James broke the NBA record for games played in the Lakers' win over the Orlando Magic on Saturday, passing Robert Parish with 1,612 career games. He may be running out of records to chase soo…",https://www.cbsnews.com/losangeles/news/lebron-james-breaks-nba-mark-for-games-played-in-lakers-win-over-magic/
LeBron James,post_2009,2026-03-22,CBS Sports,Kevin Durant passes Michael Jordan for fifth all-time in NBA scoring: How high can he go before retirement?,Kevin Durant is now fifth on the all-time scoring list after passing Michael Jordan in the Rockets' 123-122 win against the Miami Heat Saturday night. He entered the game 25 points away from tying Jo…,https://www.cbssports.com/nba/news/kevin-durant-nba-scoring-record-michael-jordan/
LeBron James,post_2009,2026-03-22,Yahoo Entertainment,James sets NBA appearance record in late Lakers win,"If you click 'Accept all', we and our partners, including 247 who are part of the IAB Transparency &amp; Consent Framework, will also store and / or access information on a device (in other words, us…",https://consent.yahoo.com/v2/collectConsent?sessionId=1_cc-session_6840af2b-6bf3-4791-a7e7-9113b23be00f
LeBron James,post_2009,2026-03-23,Yahoo Entertainment,Has LeBron James played his way back into the Lakers’ future plans?,"If you click 'Accept all', we and our partners, including 247 who are part of the IAB Transparency &amp; Consent Framework, will also store and / or access information on a device (in other words, us…",https://consent.yahoo.com/v2/collectConsent?sessionId=1_cc-session_4eea4668-7728-47b5-9c90-70da5d54ddfa
LeBron James,post_2009,2026-03-23,Yahoo Entertainment,NBA execs believe Warriors are one of two most likely LeBron James destinations,"If you click 'Accept all', we and our partners, including 247 who are part of the IAB Transparency &amp; Consent Framework, will also store and / or access information on a device (in other words, us…",https://consent.yahoo.com/v2/collectConsent?sessionId=1_cc-session_de0bb6b1-ef3a-496d-80cc-53c094fa9162
LeBron James,post_2009,2026-03-23,Vanity Fair,LeBron James Is on “a Hell of a Ride.” Now He’s Got a New Maybach for the Journey.,James worked directly with the Mercedes-Maybach Manufaktur Made to Measure individual customization atelier at corporate headquarters in Stuttgart to make the car his own. (Such services are availabl…,https://www.vanityfair.com/style/story/lebron-james-personalized-mercedes-maybach
LeBron James,post_2009,2026-03-23,Fear the Sword,NBA Rumors: Is LeBron James better off in Cleveland or Los Angeles?,"The Los Angeles Lakers are in the middle of a nine-game winning streak. LeBron James, during this stretch, is thriving as the second-fiddle for the first time in his life. Transitioning into a play-f…",https://www.fearthesword.com/cavs-analysis/46966/nba-rumors-is-lebron-james-better-off-in-cleveland-or-los-angeles
LeBron James,post_2009,2026-03-24,Yahoo Entertainment,LeBron James on turning in scoreless first half in Lakers' loss to Pistons: 'It's the role that I'm playing',"Things looked pretty bleak for the Los Angeles Lakers early in Mondays game vs. the Detroit Pistons. By halftime, the team trailed 65-52, and star LeBron James had yet to put a single point on the bo…",https://sports.yahoo.com/nba/article/lebron-james-on-turning-in-scoreless-first-half-in-lakers-loss-to-pistons-its-the-role-that-im-playing-124410495.html
LeBron James,post_2009,2026-03-24,Yahoo Entertainment,"Pistons snapped Lakers’ 9-game winnings streak, but vibes remain great","If you click 'Accept all', we and our partners, including 251 who are part of the IAB Transparency &amp; Consent Framework, will also store and / or access information on a device (in other words, us…",https://consent.yahoo.com/v2/collectConsent?sessionId=1_cc-session_9bafd31c-7689-4cc8-9169-1f112aa12a47
LeBron James,post_2009,2026-03-24,Silver Screen and Roll,All the best moments of LeBron James’ podcast with Austin Reaves,"There are few things Austin Reaves is more willing to do than appear on a fellow Lakers podcast. Reaves was a frequent guest on DAngelo Russells podcast, appeared on JJ Redicks podcast prior to him …",https://www.silverscreenandroll.com/lakers-news/111779/lebron-james-austin-reaves-lakers-podcast-steve-nash-mind-the-game-recap-summary
LeBron James,post_2009,2026-03-26,PetaPixel,Caitlin Clark Picks up the Camera and Captures LeBron James at NBA Game,"Caitlin Clark has become the latest sports star to pick up a camera and try capturing the action instead of being in it, appearing last night at an NBA basketball game. A high-profile basketball pl…",https://petapixel.com/2026/03/26/caitlin-clark-picks-up-the-camera-and-captures-lebron-james-at-nba-game/
Stephen Curry,post_2009,2026-03-01,Yahoo Entertainment,Stephen Curry says he'll be out 'a little longer' with 'unpredictable' knee rehab,"If you click 'Accept all', we and our partners, including 246 who are part of the IAB Transparency &amp; Consent Framework, will also store and / or access information on a device (in other words, us…",https://consent.yahoo.com/v2/collectConsent?sessionId=1_cc-session_5ebb42cc-6f8a-447c-af32-6ff6a982a5bf
Stephen Curry,post_2009,2026-03-01,USA Today,Warriors' Stephen Curry sends warning to NBA as playoffs near,"The Golden State Warriors have been operating with a patchwork rotation in recent weeks. Steve Kerr has been without Stephen Curry, Jimmy Butler, Kristaps Porzingis, Draymond Green and Seth Curry at …",https://warriorswire.usatoday.com/story/sports/nba/warriors/2026/02/28/warriors-stephen-curry-sends-warning-to-nba-as-playoffs-near/88930892007/
Stephen Curry,post_2009,2026-03-01,Yahoo Entertainment,Stephen Curry on right knee rehab: It's going to be a little longer,"If you click 'Accept all', we and our partners, including 246 who are part of the IAB Transparency &amp; Consent Framework, will also store and / or access information on a device (in other words, us…",https://consent.yahoo.com/v2/collectConsent?sessionId=1_cc-session_17000f11-5170-4273-bc1b-c27abc7566be
Stephen Curry,post_2009,2026-03-01,USA Today,Warriors' Stephen Curry provides health update after Lakers loss,"Stephen Curry has missed the last 10 straight games for the Golden State Warriors. The veteran sharpshooter is dealing with a knee issue. He is scheduled for re-evaluation on Sunday, March 1. Golden …",https://warriorswire.usatoday.com/story/sports/nba/warriors/2026/02/28/warriors-stephen-curry-provides-health-update-after-lakers-loss/88930460007/
Stephen Curry,post_2009,2026-03-01,Yahoo Entertainment,"Warriors no match for Lakers as LeBron James, Luka Doncic share spotlight in win at Chase Center","If you click 'Accept all', we and our partners, including 246 who are part of the IAB Transparency &amp; Consent Framework, will also store and / or access information on a device (in other words, us…",https://consent.yahoo.com/v2/collectConsent?sessionId=1_cc-session_022709fc-6166-4884-8e14-a911afdedbcd
Stephen Curry,post_2009,2026-03-01,Deadline,"‘Scream 7’ Record Loud, But ‘Pegasus 3’ Zooms Past Half Billion, ‘Wuthering Heights’ Nears $200M WW, ‘Hamnet’ Hits $93M+ WW – Global Box Office",Paramount/Spyglass’ Scream 7scored the best opening year to date for a Hollywood movie with $97.2M at the global weekend box office. As we told you there were myriad records broken for both a Paramou…,http://deadline.com/2026/03/box-office-scream-7-pegasus-3-wuthering-heights-1236740458/
Stephen Curry,post_2009,2026-03-01,Golden State of Mind,Final Score: Lakers win over Warriors 129-101 on Luka’s birthday,"Listen, there are losses you see coming, and then there are losses that still somehow feel like catching a stray. The Golden State Warriors fell 129-101 to the Los Angeles Lakers Friday night, and ho…",https://www.goldenstateofmind.com/general/108871/final-score-lakers-win-over-warriors-129-101-on-lukas-birthday
Stephen Curry,post_2009,2026-03-02,NBCSports.com,Stephen Curry to miss at least five more games with knee issue,"Stephen Curry said Saturday he would be out a little longer with the runner's knee issue officially patella-femoral pain syndrome/bone bruising that he called ""unpredictable."" That turns out to be a…",https://www.nbcsports.com/nba/news/stephen-curry-to-miss-at-least-five-more-games-with-knee-issue
Stephen Curry,post_2009,2026-03-02,Yahoo Entertainment,"Without Stephen Curry, the Warriors are just trying to stay alive","When Jimmy Butler went down for the season, the Golden State Warriors were in eighth place in the Western Conference, 2.5 games out of a top-six spot and five games clear of 11th place, smack in the …",https://sports.yahoo.com/nba/breaking-news/article/without-stephen-curry-the-warriors-are-just-trying-to-stay-alive-184817262.html
Stephen Curry,post_2009,2026-03-02,CBS Sports,"Warriors will be without Stephen Curry for at least 10 more days, but at this point does it really matter?","It's hard to give up on a Stephen Curry team. When this season started, the Warriors were regarded by many as at least a fringe contender in the Western Conference. It was a supportable position to t…",https://www.cbssports.com/nba/news/stephen-curry-injury-update-warriors-kristaps-porzingis-playoff-odds/
Stephen Curry,post_2009,2026-03-02,"HITC - Football, Gaming, Movies, TV, Music",Stephen Curry looked frustrated seeing Draymond Green crash out during Golden State Warriors timeout,Stephen Curry seemed irritated as Draymond Green vented during a Golden State Warriors timeout in their defeat to the Los Angeles Lakers. The sequence took place in Saturdays 129-101 loss at Chase C…,https://www.hitc.com/stephen-curry-looked-frustrated-seeing-draymond-green-crash-out-during-golden-state-warriors-timeout/
Stephen Curry,post_2009,2026-03-02,Yahoo Entertainment,"Steph Curry will be sidelined at least 10 more days, missing the next five games","Golden State guard Stephen Curry will be out at least 10 more days, according to the team's injury update. Curry last played on Jan. 30 and has missed the last 10 games with patellofemoral pain syndr…",https://sports.yahoo.com/nba/breaking-news/article/steph-curry-will-be-sidelined-at-least-10-more-days-missing-the-next-five-games-004150985.html
Stephen Curry,post_2009,2026-03-02,Yahoo Entertainment,"Clippers vs Warriors Prediction, Picks & Odds for Tonight’s NBA Game","If you click 'Accept all', we and our partners, including 246 who are part of the IAB Transparency &amp; Consent Framework, will also store and / or access information on a device (in other words, us…",https://consent.yahoo.com/v2/collectConsent?sessionId=1_cc-session_9c9a95dc-add2-4e8f-b566-27f5d07144de
Stephen Curry,post_2009,2026-03-02,San Francisco Chronicle,Warriors' Steph Curry remains in limbo pending another re-evaluation in 10 days,"One 10-day re-evaluation for Stephen Curry down, another one to come this month. The Golden State Warriors' star guard is set to miss the next five games with right kneecap soreness - termed as runn…",https://www.sfchronicle.com/sports/warriors/article/warriors-steph-curry-remains-limbo-pending-21948919.php
Stephen Curry,post_2009,2026-03-02,Yahoo Entertainment,"Steph Curry will be sidelined at least 10 more days, missing the next 5 games","Golden State guard Stephen Curry will be out at least 10 more days, according to the team's injury update. Curry last played on Jan. 30 and has missed the last 10 games with patellofemoral pain syndr…",https://sports.yahoo.com/nba/breaking-news/article/steph-curry-will-be-sidelined-at-least-10-more-days-missing-the-next-5-games-004150109.html
Stephen Curry,post_2009,2026-03-02,Yahoo Entertainment,"Without Stephen Curry, the Warriors are just trying to stay alive","When Jimmy Butler went down for the season, the Golden State Warriors were in eighth place in the Western Conference, 2.5 games out of a top-six spot and five games clear of 11th place, smack in the …",https://sports.yahoo.com/nba/article/without-stephen-curry-the-warriors-are-just-trying-to-stay-alive-184817262.html
Stephen Curry,post_2009,2026-03-02,Golden State of Mind,How to watch Warriors vs. Clippers,The Golden State Warriors will host another Southern California rival as they take on the Clippers on Monday night. The game will be played at 7:00 PM PT in San Francisco and can be watched on Peacoc…,https://www.goldenstateofmind.com/warriors-game-previews/108910/how-to-watch-warriors-vs-clippers
Stephen Curry,post_2009,2026-03-03,USA Today,"Sources: Stephen Curry, Draymond Green will 'heavily recruit' LeBron","It seems that if LeBron James decides to continue playing in the NBA past this season but wants to leave the Los Angeles Lakers, the only truly logical destination for him would be the Cleveland Cava…",https://lebronwire.usatoday.com/story/sports/nba/lebron/2026/03/03/sources-stephen-curry-draymond-green-will-heavily-recruit-lebron/88956688007/
Stephen Curry,post_2009,2026-03-03,"HITC - Football, Gaming, Movies, TV, Music",Stephen Curry and Draymond Green will ‘heavily’ recruit LeBron James to Golden State Warriors,Stephen Curry and Draymond Green are reportedly preparing to make a strong push to recruit LeBron James to the Golden State Warriors in free agency. James is poised to enter unrestricted free agency…,https://www.hitc.com/stephen-curry-and-draymond-green-will-heavily-recruit-lebron-james-to-golden-state-warriors/
Stephen Curry,post_2009,2026-03-03,Yahoo Entertainment,We now know real reason Warriors didn't pair Stephen Curry with Lonzo Ball via buyout,"If you click 'Accept all', we and our partners, including 246 who are part of the IAB Transparency &amp; Consent Framework, will also store and / or access information on a device (in other words, us…",https://consent.yahoo.com/v2/collectConsent?sessionId=1_cc-session_a99271b1-5c17-49c9-abb0-a581471b8623
Stephen Curry,post_2009,2026-03-03,Yahoo Entertainment,Kawhi Leonard scores 23 points and Clippers rally from 17-point deficit to beat Warriors 114-101,"SAN FRANCISCO (AP) Kawhi Leonard had 23 points, eight rebounds and four assists, and the Los Angeles Clippers erased a 17-point deficit to beat the short-handed Golden State Warriors 114-101 on Monda…",https://sports.yahoo.com/articles/kawhi-leonard-scores-23-points-054502638.html
Stephen Curry,post_2009,2026-03-04,Just Jared,Kyrie Irving Publicly Pitches to Recruit Steph Curry to ANTA Footwear,Kyrie Irving is openly making his pitch for Stephen Curry to join him at ANTA footwear brand. The Dallas Mavericks star recently spoke about the possibility of the Golden State Warriors guard signin…,https://www.justjared.com/2026/03/04/kyrie-irving-publicly-pitches-to-recruit-steph-curry-to-anta-footwear/
Stephen Curry,post_2009,2026-03-04,NBCSports.com,"Will Steve Kerr coach the Warriors next season? GM Dunleavy says, 'I don’t see why not'","Steve Kerr is in the final year of his contract, but he's not exactly stressing about it. After a dozen years and four rings coaching Stephen Curry and the Golden State Warriors, Kerr's reaction when…",https://www.nbcsports.com/nba/news/will-steve-kerr-coach-the-warriors-next-season-gm-dunleavy-says-i-dont-see-why-not
Stephen Curry,post_2009,2026-03-05,The Sportsrush,"Steve Kerr Defends Brandon Podziemski’s Place in Warriors’ Rotation, Says “He’s Still Finding His Way”","The Golden State Warriors season continues to unravel in the absence of Stephen Curry, and the way the current offense runs has left fans frustrated. Although occasional box scores go in favor of you…",https://thesportsrush.com/nba-news-steve-kerr-defends-brandon-podziemskis-place-in-warriors-rotation-says-hes-still-finding-his-way/
